{
  "profile_id": "core-methodology",
  "authority_class": "methodology",
  "controlled_profile": true,
  "version": "v1",
  "skills": [
    "brainstorming",
    "dispatching-parallel-agents",
    "executing-plans",
    "finishing-a-development-branch",
    "receiving-code-review",
    "requesting-code-review",
    "subagent-driven-development",
    "systematic-debugging",
    "test-driven-development",
    "using-git-worktrees",
    "using-superpowers",
    "verification-before-completion",
    "writing-plans",
    "writing-skills"
  ],
  "promotion_gate": {
    "requires_registry_metadata": true,
    "requires_evaluation_status": "accepted",
    "requires_controller_import": true
  }
}
